{
  "$schema": "https://json-schema.org/draft/2020-12/schema",
  "$id": "https://echoforge.local/schemas/radar_episode.schema.json",
  "title": "radar_episode",
  "description": "EchoForge radar_episode document. A single recorded or simulated radar episode produced from a scenario, listing the on-disk product artifacts (range-Doppler maps, IQ, detections, etc.) and the sampling rate used. Conforms to the EchoForge strict-open contract: deterministic ids, explicit provenance, license, and validation envelope.",
  "type": "object",
  "additionalProperties": false,
  "required": [
    "id",
    "kind",
    "schema_version",
    "public_proxy_id",
    "provenance",
    "license",
    "validation",
    "episode_name",
    "scenario_id",
    "sample_rate_hz",
    "product_paths"
  ],
  "properties": {
    "id": {
      "description": "Deterministic EchoForge id of the form ef:<kind>:<public_proxy_id>:<16hex>:1, computed from the identity field tuple.",
      "$ref": "https://echoforge.local/schemas/common.schema.json#/$defs/deterministic_id"
    },
    "kind": {
      "description": "Document kind discriminator; must be the literal string \"radar_episode\".",
      "const": "radar_episode"
    },
    "schema_version": {
      "description": "Schema contract version this document conforms to (currently pinned to 1.0.0).",
      "$ref": "https://echoforge.local/schemas/common.schema.json#/$defs/schema_version"
    },
    "public_proxy_id": {
      "description": "Slug identifying the public proxy this radar episode is derived from (lowercase, dot/underscore/hyphen separated).",
      "$ref": "https://echoforge.local/schemas/common.schema.json#/$defs/slug"
    },
    "provenance": {
      "description": "Provenance envelope: source kind, source references, generator, timestamp, and payload fingerprint.",
      "$ref": "https://echoforge.local/schemas/common.schema.json#/$defs/provenance"
    },
    "license": {
      "description": "License envelope (SPDX id and optional notice) governing use of this document.",
      "$ref": "https://echoforge.local/schemas/common.schema.json#/$defs/license"
    },
    "validation": {
      "description": "Validation envelope: tier, overall status, uncertainty score, and per-check results.",
      "$ref": "https://echoforge.local/schemas/common.schema.json#/$defs/validation"
    },
    "episode_name": {
      "description": "Human-readable name of the episode (e.g. \"intersection_run_007\"); non-empty string.",
      "type": "string",
      "minLength": 1
    },
    "scenario_id": {
      "description": "Deterministic id of the scenario document this episode was produced from.",
      "$ref": "https://echoforge.local/schemas/common.schema.json#/$defs/deterministic_id"
    },
    "sample_rate_hz": {
      "description": "Complex baseband sampling rate in hertz (Hz) used to produce the episode products; must be strictly positive.",
      "type": "number",
      "exclusiveMinimum": 0
    },
    "product_paths": {
      "description": "Relative paths (from the episode root) to product artifacts such as range_doppler, iq, detections, tracks; at least one entry required.",
      "type": "array",
      "minItems": 1,
      "items": {
        "type": "string",
        "minLength": 1
      }
    }
  }
}
